{
  "name": "Alamanda Steffanie",
  "email": "gracealamanda377@gmail.com",
  "phone": "9989654665",
  "education": [
    {
      "degree": "",
      "institution": "",
      "year": ""
    },
    {
      "degree": "",
      "institution": "",
      "year": ""
    },
    {
      "degree": "",
      "institution": "Malla Reddy College of",
      "year": ""
    },
    {
      "degree": "B.TECH",
      "institution": "",
      "year": ""
    }
  ],
  "experience": [
    {
      "company": "DevElet",
      "position": "FRONT END INTERN",
      "duration": "August 2024 - September 2024",
      "description": "FRONT END INTERN Developed Weather Forecast Application Developed a Netflix Clone September 2024 - October2024"
    },
    {
      "company": "DevElet",
      "position": "FULL STACK INTERN",
      "duration": "September 2024 - October2024",
      "description": "FULL STACK INTERN Created Personal Portfolio Website Developed Task Manager Application Skilligence Ethical Hacking at IIT-Hyderabad CodeKaro - HTML, CSS (10/2024) Internshala - Ethical Hacking (10/2024 - 11/2024) Internshala - Web Development Cambridge English Empower Level C1 Course Wadhwani - JobReady Employability Skills S O F T W A R E   D E V E L O P E R CGPA: 9.33 Malla Reddy College of Engineering and Technology B.TECH English Telugu PERSONAL PROJECTS Detects DeepFake content using deep learning techniques to ensure authenticity in digital media. SPEAKSOLVE: VOICE ASSISTED SCIENTIFIC CALCULATOR A voice-assisted scientific calculator that solves complex equations through voice commands for hands-free convenience. DEEPVISION: DEEPFAKE DETECTION USING DEEPLEARNING linkedin.com/in/a-steffanie-grace- 797935293"
    }
  ],
  "skills": [
    "java",
    "go",
    "r",
    "html",
    "css",
    "sql",
    "git",
    "github",
    "machine learning",
    "deep learning"
  ],
  "text": "\n\nResonance Junior College\nINTERMEDIATE EDUCATION\nCGPA: 8.4\nSt.Anns High School\nSECONDARY EDUCATION\nCGPA: 9.7\nINTERNSHIP\nAspiring Full Stack Web Developer focused on growth in\nweb development, AI, and cybersecurity. Eager to apply\nmy  skills  to  impactful  projects  while  gaining  hands-on\nexperience.\nSUMMARYCONTACT\n9989654665\nHyderabad, India\ngracealamanda377@gmail.com\nhttps://github.com/codeK2004 \nALAMANDA STEFFANIE\nGRACE\nSKILLS\nPROFESSIONAL\nJava \nCybersecurity Fundamentals \nSQL/Database Management \nMachine Learning Algorithms \nHTML \nCSS \nAugust 2024 - September 2024 \nDevElet\nFRONT END INTERN\nDeveloped Weather Forecast Application\nDeveloped a Netflix Clone\nSeptember 2024 - October2024 \nDevElet\nFULL STACK INTERN\nCreated Personal Portfolio Website\nDeveloped Task Manager Application\nCERTIFICATES\nSkilligence Ethical Hacking at IIT-Hyderabad \nCodeKaro - HTML, CSS (10/2024) \nInternshala - Ethical Hacking (10/2024 - 11/2024)\nInternshala - Web Development\nCambridge English Empower Level C1 Course\nWadhwani - JobReady Employability Skills\nS O F T W A R E   D E V E L O P E R\nEDUCATION\nCGPA: 9.33\nMalla Reddy College of\nEngineering and Technology\nB.TECH\nLANGUAGES KNOWN\nEnglish\nHindi\nTelugu\nPERSONAL PROJECTS\nDetects DeepFake content using deep learning\ntechniques to ensure authenticity in digital media.\nSPEAKSOLVE: VOICE ASSISTED SCIENTIFIC CALCULATOR\nA voice-assisted scientific calculator that solves complex\nequations through voice commands for hands-free\nconvenience.\nDEEPVISION: DEEPFAKE DETECTION USING DEEPLEARNING\nlinkedin.com/in/a-steffanie-grace-\n797935293"
}